{
  "config_version": "1.3.0",
  "scope": "dataset_validation_only",
  "service_contract_mapping": "partial_with_blocked_decisions",
  "inquiry_statuses": [
    "DRAFT",
    "QUESTIONNAIRE_IN_PROGRESS",
    "AI_GUIDANCE",
    "CONSULTATION_REQUIRED",
    "CONSULTATION_IN_PROGRESS",
    "VISIT_REVIEW_PENDING",
    "VISIT_SCHEDULING",
    "VISIT_SCHEDULED",
    "COMPLETION_PENDING",
    "REVISIT_REQUIRED",
    "REOPENED",
    "RESOLVED",
    "CANCELLED"
  ],
  "visit_statuses": [
    "ASSIGNING",
    "SCHEDULING",
    "CONFIRMED",
    "IN_PROGRESS",
    "COMPLETED",
    "FOLLOW_UP_REQUIRED",
    "CANCELLED"
  ],
  "risk_levels": [
    "general",
    "caution",
    "danger"
  ],
  "usage_guidance_statuses": [
    "NORMAL",
    "PARTIAL_STOP",
    "TOTAL_STOP",
    "PENDING_CONSULTATION"
  ]
}
